{
  "id": "E-FND-01",
  "variant": "DRILLED_SHAFT_PILE",
  "label_fr": "Pieu foré",
  "label_en": "Drilled-shaft pile",
  "geometryParams": [
    { "key": "D", "unit": "mm", "label_fr": "Diamètre", "label_en": "Diameter", "min": 0 },
    { "key": "L", "unit": "mm", "label_fr": "Longueur", "label_en": "Length", "min": 0 }
  ],
  "As_zones": [
    { "key": "As_longitudinal", "label_fr": "Aciers longitudinaux", "label_en": "Longitudinal steel", "unit": "cm2", "kind": "longitudinal" },
    { "key": "As_dowels", "label_fr": "Aciers en attente (recépage)", "label_en": "Dowel / starter steel", "unit": "cm2", "kind": "longitudinal" }
  ],
  "compatibleSchemes": ["PILE_CAGE"],
  "validationProfile": "CIRCULAR_COLUMN"
}
